Title,Company,Location,Postdate,ExtractDate,Summary,Salary,JobURL
Supervisor de Información y Bases de Datos,PlayCity Casino,"Tlalpan, CDMX",hace 2 días,2021-01-24,Únete al mejor equipo de trabajo y vive la “Experiencia Play”. Tendrás oportunidad de desarrollar una carrera en el mejor casino de México.,"$25,000 al mes",https://mx.indeed.com/pagead/clk?mo=r&ad=-6NYlbfkN0ARZ6FD_sGVUlGBzehOYNtGzUDZUjJmHvpVAt3NcHx3Z0EojSYCsOFVAwe3aTTQoWJc8CD-5SHmwlwCtentlPReJZ5MuTD6pTrjVoHKmcKpajIFQLAns2QxZd8ZiArbqimiHjBX5x-LbMtbL3icxo6ASeptTPkVSjTOz33KAo_xiBwkduZpc0KEAQ9tcoMXf4c3IBTzjnmB9qabaNA6Fq4oIUPXPrq6jYzk7TD0c9KLPRb8d6OYr06U9fqZQ_zWvPaGS41S6uG5Iga1sfpVF-VPDxv7ktWZd6cVaefcDwNjFQyap6_tY0JTrvXYbSaC_DeCLZJgE2ff509iginyncKybzmGY3grl9jWe2zahf2z03BMivIXlIQwjlSSktDRarA0CV06Ivzm43ceAXorfRKBpJLyODjTnMdC5FCfhgxoqJCYVhVM2IlPezMK1A6V0X7rr80ry7tfRqP0tlrf2LshDlJEp1Aol9f6bZo81dxaAjJFTHJdYdIC-7qoqZuIcopdxxbvoL-Csg==&p=3&fvj=1&vjs=3
Desarrollador PHP,Denumeris Interactive Agency,"Álvaro Obregón, CDMX",hace 5 días,2021-01-24,"Ing. en sistemas, Lic. en Informática o Carrera a fin. Experiencia mínima de 3 años como Desarrollador PHP. HTML,css3,JQuery,Java Script.","$15,000 - $20,000 al mes",https://mx.indeed.com/rc/clk?jk=aaf2c75a77d37f2c&fccid=942c4ec626ccb63b&vjs=3
Administrador de WebLogicServer y SOA,BLK Global Logistics,"Coyoacán, CDMX",hace 2 días,2021-01-24,Conocimiento en programación java para identificar componentes de una aplicación. Administrador de WebLogicServer y SOA. Temporalmente debido al COVID-19.,"$20,000 - $30,000 al mes",https://mx.indeed.com/company/BLK/jobs/Administrador-weblogicserver-soa-813192069639c91e?fccid=377eb72a2df92016&vjs=3
Ingeniero de Sistemas,Grupo Estrella Esmeralda SA de CV,"Venustiano Carranza, CDMX",hace 18 días,2021-01-24,Experiencia mínima de 2 años en programación con Python. Empresa importadora y distribuidora de accesorios de moda para dama.,"$15,000 - $18,000 al mes",https://mx.indeed.com/company/Grupo-Estrella-Esmeralda-SA-de-CV/jobs/Ingeniero-sistemas-b520054e0b61ab62?fccid=f20f45f4a6705335&vjs=3
Ingeniero de Automatización y Control,EOS Project México,"Miguel Hidalgo, CDMX",hace 3 días,2021-01-24,Experiencia en desarrollo y programación de estrategias y filosofías de control y operación para equipos de la industria alimentaria o química como evaporadores…,,https://mx.indeed.com/company/EOS/jobs/Ingeniero-automatizaci%C3%B3n-control-f4ff15e04281120b?fccid=866134be7693f998&vjs=3
Desarrollador en Unity,Figment,"Miguel Hidalgo, CDMX",hace 15 días,2021-01-24,Conocimientos en otros idiomas de programación. Estamos buscando un programador responsable de construir juegos para varias plataformas basadas en Unity.,,https://mx.indeed.com/company/Figment/jobs/Desarrollador-unity-53f6be403220e96e?fccid=003596b6a070b1e0&vjs=3
Analista de Sistemas,"CABLETAMPS, S.A. DE C.V.","Coyoacán, CDMX",hace 15 días,2021-01-24,\*CONTRATO TEMPORAL POR INCAPACIDAD DE MATERNIDAD\*. Escolaridad: Ingeniero de sistemas o afín. Conocimientos básicos en Linux y Windows Server.,"$12,500 al mes",https://mx.indeed.com/company/CABLETAMPS-SA-DE-CV/jobs/Analista-sistemas-26bbb36619bb9536?fccid=fb0363aa55138dd8&vjs=3
Desarrollador Back End,Umvel,"Colonia Condesa, CDMX",hace 3 días,2021-01-24,Seguir buenas prácticas de programación. Realizar el desarrollo de software utilizando el lenguaje de programación JavaScript (NodeJS).,"$25,000 al mes",https://mx.indeed.com/company/Umvel/jobs/Desarrollador-back-end-e77a63583902f46b?fccid=24ca1f07d3a98371&vjs=3
Machine Learning,PRAXIS TI,"Cuauhtémoc, CDMX",hace 11 días,2021-01-24,"PRAXIS, es una empresa Mexicana Líder en Tecnologías de la Información, con presencia Internacional, y con 25 años proporcionando servicios de TI.",,https://mx.indeed.com/rc/clk?jk=951860224df29922&fccid=942c4ec626ccb63b&vjs=3
SOPORTE TECNICO,RC CORPORATIVO,"Benito Juárez, CDMX",Hace más de 30 días,2021-01-24,RC Corporativo consultoría financiera solicita persona para el area de: SOPORTE TECNICO CON CONOCIMMIENTO EN PROGRAMACION. Edad: 25 a 40 años.,,https://mx.indeed.com/rc/clk?jk=d8aab09692195b23&fccid=402f28e52ffaf852&vjs=3
Analista de Soporte Técnico,MEDICAL DIMEGAR,"Azcapotzalco, CDMX",hace 12 días,2021-01-24,Analista de soporte técnico e infraestructura *. Edad 24 a 45 años. En sistemas Computacionales o carrera a fin. Revisar y cotizar equipos tecnológicos.,"$8,000 al mes",https://mx.indeed.com/company/MEDICAL-DIMEGAR/jobs/Analista-soporte-t%C3%A9cnico-a1f161cb64cea873?fccid=8be960fd3f9847ad&vjs=3
DOCENTE DE PROGRAMMING Y ICT (SECUNDARIA),The Bright House Academy,"Benito Juárez, CDMX",hace 3 días,2021-01-24,"Conocimientos en lenguajes de programación orientados a objetos con enfoque en microcontroladores (Javascript, Python, C++). Que sea disciplinado y responsable.",$150 - $200 por hora,https://mx.indeed.com/pagead/clk?mo=r&ad=-6NYlbfkN0DHDoWKzBivqlXIafL8D4EGCahWsxn-nsU11mz4_m1IBKOGZtaivRyKH-RE8deqckKAm1l3_D0r4OotJef8xGnQ1w3PQ-ORPtdG8xeUSzm65JBq5L4PJSU-U3VIQDdvzsBwScvDzXi20Jd9ozIrgSLIvQNPk9XlOETbaeaCadSyuCzkf2iJl_xCMQ4yICll8uGvrUckY9cgOm3jugzu-mRbVUwO-M7S1cBS2HnaApz96r3XFU3yM-slInAOmFt1SpvVDqGTz7IcT11We7hpPVHTCrrK_rVvTjErxHGmN6hxQGEr3UIl7bZVpTtuoPh0zPScesUG5gexSgEKzHsNCv9kt-T6VA1GBEeD4AdKMwKuUkhlbmtiyTV70a43QiQ9zTUCoZzfvMvo7-3aicvhnjUSCGiG0pR4NNsAD-p392dYhbs1vMsc8QAkvcOrrypJMciuuKEUaCOLOfpLzlutkIZeSL4V9tuuEKwqKdw0-PUdG50xGLV5ZRtJ&p=14&fvj=1&vjs=3
Full Stack Developer,Entersol,"Benito Juárez, CDMX",hace 8 días,2021-01-24,Micro servicios escalables horizontalmente escritos y aprovechando técnicas de programación funcional. En ENTERSOL confiamos que el talento humano es el activo…,"$19,000 al mes",https://mx.indeed.com/pagead/clk?mo=r&ad=-6NYlbfkN0Ciwzz3aHBngsPBIFiORAsyzMvEBJO4W0r-wyZq9YYzK08k2TCv7RHXBi0nKQ5YgXRfY_m1GzSrYh-Ai6Go3cbsDkqTYrXL8lLUTpSPBq_bgeANLhRCoUbaasr6twOfZcVWPJq_GUkIcj3CAaYcc1zjeTvcQVkIlR26Bn3RHnaBA41HGniNHzdI71Qm2A7zZ4ziDAmHQEzXnsdX9r7COzlh16HgaXtlx1m-GsvcJmHogaGR5w3UOZtQjiUl-TRTvXrOMZwBzQKNowFBuuH8L5wdUPa3jf1-Ta3kzSdkNWfyKxblL4wjhx7WKPEyi0Mb-1GzLwTOUwyOj3iW4CZr-J3c962hExG1_RpXVv4zn9LqD6xXCAUJ4SRmtRvZ6qilxNs6odnd-f0fQZdrXm90ENjOwtR6_VVmBwNF9LMOJ9xtIEanxaIwzm8kVBD4taq--LXfqcZphiq2NS-Yj1HM3gOh&p=15&fvj=1&vjs=3
¿Te encanta programar? Web/Móvil Backend & Frontend. Programador Jr,M22,"Coyoacán, CDMX",Hace más de 30 días,2021-01-24,"Aprendizaje y desarrollo con lenguajes de programación para sistemas web y aplicaciones móviles. Ahora estamos buscando a una persona que, al igual de todos los…","$12,000 - $20,000 al mes",https://mx.indeed.com/pagead/clk?mo=r&ad=-6NYlbfkN0DxmIgQqch13PGkj6ugSzylEzKPimiy2zCuNjU_g2WdPwXOnVBAMrjtYMwJEp-PDOQXbMrKiIaZlnjkV6XA9HkD25wG13cXi43TYsk_QiJXKYZfSAl71U_FdoV29WLUoQCEi0rvjQh0BYXIJ1-DJX4tFUOgb0rCNO1JDctlcPQCzhmjZ-5H_uuNsXVtl4AiPzsvaSaaHaKuYGQCse6BEttVjUBq5LN617tTeW1dzVR0_cuwsMCs_2B4neD3FnybX0Tt39PYQQ8bxgCeeL2-0zGSZ9-89G2b3-nPpIm8gA02GtEU06_Gynw2pN0lngo3cNtLdKMEsyut-8N4vQrbH6ieeRS4k-7w0zM2vsi3rYYA1uETV7ZXO9vhob5v9MtQIeBYrKjKG-590rK40a_c6JY3PSSf_Sf38FSAKwoHT33SwjDstZIXUQZpCE3X-VdCa_Cw0XcJ3AIAN839eWRcXhIdplmnTuiG6Ma3FW1_SxuCjCXbY2Z95KFxcRX9zqdh1YWETHD6u8vmPCx1Epia5YfP&p=16&fvj=1&vjs=3
Gte Buro de Credito No Tarjeta,Santander,"Cuajimalpa, CDMX",hace 17 días,2021-01-24,"Habilidades en programación - SAS, SQL o R. Sé parte de nuestro equipo de Riesgos en el puesto de: Gerente de Información a Buró de Crédito.",,https://mx.indeed.com/rc/clk?jk=ecbf3ab0c61bc211&fccid=e57a47a3d1d90e39&vjs=3
Desarrollador Tester Q.A. JR,"Lunave Multimedios, S.A. de C.V.","Miguel Hidalgo, CDMX",hace 16 días,2021-01-24,"Conocimientos en lenguajes de programación y tecnologías como: Selenium Post man, JUnit, OWASP ZAP, SonarQube, IOS, Android, Java, PHP.","$12,000 - $14,000 al mes","https://mx.indeed.com/company/Lunave-Multimedios,-S.A.-de-C.V./jobs/Desarrollador-tester-q-junior-f7c01e58e2e444d4?fccid=273d214ef0a406ab&vjs=3"
Desarrollador Android,J2E soluciones,"Miguel Hidalgo, CDMX",hace 1 día,2021-01-24,"Puesto solicitante: Mobile Application Developer / Android (Semi-Senior). Carrera: Ingeniero, Técnico o Licenciado en Sistemas Computacionales o a fin.","$35,000 al mes",https://mx.indeed.com/company/J2E-soluciones/jobs/Desarrollador-android-4c49a5e37d3d5e3a?fccid=cd38f75bb2b9c1ac&vjs=3
Frontend Developer React / Remoto,JADE MX,"Colonia Roma, CDMX",hace 4 días,2021-01-24,"Empresa que comercializa productos de retiro a través de canales digitales, busca un Frontend Developer React / Remoto .. MERN Stack y soluciones a problemas.","$25,000 - $35,000 al mes",https://mx.indeed.com/company/JADE-MX/jobs/Frontend-developer-react-be289e38be81b2e4?fccid=f4760fcf5afe47ce&vjs=3
Programador Unity Sr.,INMERSYS,"Coyoacán, CDMX",hace 12 días,2021-01-24,Conocimientos avanzados con Unity Game Engine y lenguaje de programación C# por lo menos de 3 años. ¿Eres un crack en Unity? ¡Estamos buscando personas como tú!,"$21,000 al mes",https://mx.indeed.com/company/INMERSYS/jobs/Programador-unity-senior-dac754803fad136e?fccid=a6ade46f92deb10a&vjs=3
Arquitecto de Soluciones,Consultora TI,"Cuauhtémoc, CDMX",hace 7 días,2021-01-24,+4 años de Desarrollo y programación de software. Esta vacante viene de la bolsa de empleo Talenteca.com. Empresa Multinacional especialista en Arquitectura…,"$42,000 al mes",https://mx.indeed.com/rc/clk?jk=90621436a9f396de&fccid=f45888440fef5091&vjs=3
Analista Programador de Sistemas de Información,"CENEVAL, A.C.","Benito Juárez, CDMX",hace 4 días,2021-01-24,"Análisis de procesos, base de datos, programación: 2 años (Requisito mínimo). _Programación de sistemas de información web utilizando lenguaje de programación…","$16,000 - $16,500 al mes","https://mx.indeed.com/company/CENEVAL,-A.C./jobs/Analista-programador-sistemas-informaci%C3%B3n-f4b721679c6c06fe?fccid=2eeb70bb98b3e06e&vjs=3"
Programador,Qually Corporacion S.A. De CV,"Colonia Tacuba, CDMX",hace 12 días,2021-01-24,"_Importante Laboratorio, Tercero Autorizado como Laboratorio de Pruebas, Unidad Analítica / Estudios de Biodisponibilidad y Bioequivalencia, y Perfiles de…",,https://mx.indeed.com/company/Qually-Corporacion-S.A.-De-CV/jobs/Programador-2fd6d12177cdaa86?fccid=fd825cfec0bdf44a&vjs=3
Desarrollador Senior,Warriors Lab's,"Benito Juárez, CDMX",hace 11 días,2021-01-24,Empresa mexicana* líder en el desarrollo e investigación en TI. Está en búsqueda de INGENIEROS TITULADOS para integrarse al área de Sistemas como *Desarrollador…,"$16,000 - $22,000 al mes",https://mx.indeed.com/company/WARRIORS-LABS-S.A-de-C.V/jobs/Desarrollador-senior-6c4deb58f132ca8a?fccid=7c5c60b57362e99e&vjs=3
SUPERVISOR (A) DE TRAFICO / CDMX,TRANSPORTES MINERVA S.A. DE C.V.,"Azcapotzalco, CDMX",hace 13 días,2021-01-24,Comunicación y seguimiento a lavado para la programación de lavado y liberación de remolques. Empresa 100% Mexicana Enfocada en Transporte Terrestre Solicita: *…,"$11,000 al mes",https://mx.indeed.com/company/Transportes-Minerva/jobs/Supervisor-trafico-bb8540ba157f9c9e?fccid=ba50c4376286458e&vjs=3
INGENIERO DE INFRAESTRUCTURA,PRAXIS TI,"Benito Juárez, CDMX",hace 11 días,2021-01-24,"EXPERIENCIA: De 3 a 5 años en nociones de programación estructurada. Importante Empresa de Consultoría, especializada en Tecnología de la Información, solicita:…",,https://mx.indeed.com/rc/clk?jk=f260decffddebaad&fccid=942c4ec626ccb63b&vjs=3
EJECUTIVO DE LOGISTICA NACIONAL,TALENTO EN COMERCIO EXTERIOR,Ciudad de México,Hace más de 30 días,2021-01-24,EMPRESA LIDER EN LOGISTICA Y TRANSPORTE SOLICITA EJECUTIVO DE LOGISTICA CON LOS SIGUIENTES CONOCIMIENTOS: Negociaciópn de tarifas con proveedores.,,https://mx.indeed.com/rc/clk?jk=3ecfb38cf2a7259a&fccid=601a40de7619d99f&vjs=3
Ingeniero de Ventas de Soluciones y Servicios (Seguridad),Bosch Group,Ciudad de México,hace 7 días,2021-01-24,"Conocimientos: programación, manejo de CRM, Microsoft Office. Bosch fue fundada en Stuttgart en 1886 por Robert Bosch (1861-1942), y por más de 130 años se ha…",,https://mx.indeed.com/rc/clk?jk=221b2ac569d2de6d&fccid=a2faf1301ac6ad4b&vjs=3
Jefe de Mantenimiento,GRUPO SOEL SA DE CV,"Cuajimalpa, CDMX",hace 25 días,2021-01-24,Garantizar de mantenimiento (preventivos y correctivos). Crear e implementar políticas y procesos. Gestión del equipo (Evaluación de KPIS).,"$20,000 al mes",https://mx.indeed.com/company/Grupo-Contadero-S.A-de-C.V/jobs/Jefe-mantenimiento-a4358c02ec51513c?fccid=5ace18c58ef5a231&vjs=3
ING. QUIMICO EN ALIMENTOS (REPRESENTANTE TÉCNICO VENTAS DE EXPORTACIÓN),COMPLEMENTOS ALIMENTICIOS SA DE CV,"Azcapotzalco, CDMX",Hace más de 30 días,2021-01-24,Elaborar o coordinar con Servicio al Cliente / Administración de Ventas la programación de entregas de pedidos.,,https://mx.indeed.com/rc/clk?jk=3ee57865d3af6688&fccid=8593bc19297d3792&vjs=3
ING. QUIMICO EN ALIMENTOS (REPRESENTANTE TÉCNICO VENTAS DE EXPORTACIÓN),COMPLEMENTOS ALIMENTICIOS SA DE CV,"Azcapotzalco, CDMX",Hace más de 30 días,2021-01-24,Elaborar o coordinar con Servicio al Cliente / Administración de Ventas la programación de entregas de pedidos.,,https://mx.indeed.com/rc/clk?jk=3ee57865d3af6688&fccid=8593bc19297d3792&vjs=3
Ingeniero en Desarrollo y Programación,Vía Transfer Integral,"Benito Juárez, CDMX",Hace más de 30 días,2021-01-24,"Programador en el lenguaje a desarrollar, con experiencia.",,https://mx.indeed.com/rc/clk?jk=5716fa78d57aa7fa&fccid=2e4b8d012aad7beb&vjs=3
Analista Programdor .Net,Stephannie López,Ciudad de México,Hace más de 30 días,2021-01-24,"Mínimo 2 años en programación web Visual Studio . Importante empresa líder en la fabricación y comercialización de artículos plásticos para el hogar, solicita:","$20,000 al mes",https://mx.indeed.com/rc/clk?jk=17fc9de6dd69dc13&fccid=5ce94758becb9502&vjs=3
OPERADOR DE EXTRUCCIÓN DE POLIETILENO,HV Plásticos,"Cuauhtémoc, CDMX",Hace más de 30 días,2021-01-24,"Asegurar que la producción cumpla con las especificaciones requeridas a través de las correcciones y observaciones del Supervisor, Jefe de Producción y…",,https://mx.indeed.com/rc/clk?jk=85c0a2cef2d4c6cd&fccid=0fe2540f61d2e576&vjs=3
WEB DEVELOPER FOR USA PROJECTS,Epik solutions,"Colonia Polanco, CDMX",hace 10 días,2021-01-24,"Carrera en ingeniería en sistemas, TICS, software developer engineer, programación, informática, computación o cualquier otra relacionada con las TI (IT).","$5,878 - $21,436 al mes",https://mx.indeed.com/company/Epik-solutions/jobs/Web-developer-USA-projects-981bdcf0a0503628?fccid=820ae6cdc04f9bce&vjs=3
Administrador de Obra,GRUPO GWEP,"Tláhuac, CDMX",hace 17 días,2021-01-24,"\*Integración de pagos semanales, recabar autorizaciones en obra de pago (estimaciones), recabar facturas de contratistas (vigilar que cumplan con requisitos),…","$15,000 - $18,000 al mes",https://mx.indeed.com/company/Cumbres-Herradura/jobs/Administrador-obra-b1b1ef13816c5467?fccid=c7b54eea31a8bded&vjs=3
Supervisor de Laboratorio (Desarrollo Analítico),Ciencia Desarrollo e Innovación S.A. de C.V.,"Benito Juárez, CDMX",hace 14 días,2021-01-24,"Ayuda a la jefatura del laboratorio a la que le reporte al control y monitoreo de recursos humanos y tecnológicos a su cargo, mediante la planeación de…","$16,500 - $18,500 al mes","https://mx.indeed.com/company/Ciencia,-Desarrollo-e-Innovaci%C3%B3n-S.A.-de-C.V./jobs/Supervisor-laboratorio-62723dc7a7d2645a?fccid=e45ecc1db98cef84&vjs=3"
Encargada de tienda,"Carnes frías, quesos, vinos, abarrotes “Inhumana”","Tlalpan, CDMX",Hace más de 30 días,2021-01-24,"Inventarios y programación de pedidos. “Inhumana, carnes frías, quesos, vinos, abarrotes” solicita: Encargada de tienda con experiencia en puesto o similar,…","$6,000 al mes",https://mx.indeed.com/company/Inhumana/jobs/Encargada-tienda-ac05cd9cb8ad5d83?fccid=e62e44bba2726def&vjs=3
ANALISTA DE TELECOMUNICACIONES,Consorcio Jurídico de Cobranza Especializada,Ciudad de México,Hace más de 30 días,2021-01-24,"Conocimientos en sistemas operativos, metodologías de programación,. Zona laboral: Ciudad de México. Consorcio Jurídico es una empresa dedicada a la gestión de…",,https://mx.indeed.com/rc/clk?jk=658c072a32162bc9&fccid=d25d4a2a193bb1b7&vjs=3
Project Leader( FREENLACE),J2E soluciones,"Miguel Hidalgo, CDMX",hace 19 días,2021-01-24,"Conocimientos en lenguajes de programación: HTML5, CSS3, JQuery, JavaScript, C#, Java. Puesto solicitante: *Project Leader (FREENLACE). $140 a $200 por hora.",$200 por hora,https://mx.indeed.com/company/J2E-soluciones/jobs/Project-leader-d7a1c1549c41ab90?fccid=cd38f75bb2b9c1ac&vjs=3
FULL STACK - QA ENGINEER,"Grupo Siayec, S.A. de C.V.","Benito Juárez, CDMX",hace 2 días,2021-01-24,Desarrollo y programacion en Js12+ y Js16+. Somos una empresa Experta en soluciones de TI y estamos en busqueda de tu talento como: *.,"$20,000 - $25,000 al mes",https://mx.indeed.com/company/Grupo-Siayec/jobs/Full-stack-ed46795eba9e3a5b?fccid=8b45da538ecb1bec&vjs=3
Ejecutivo de cuenta (Ventas Técnicas),ENLACE LABORAL,Ciudad de México,Hace más de 30 días,2021-01-24,Ejecutivo de cuenta (Ventas Técnicas). Edad: 30 a 45 años. Disponibilidad de viajar – aprox 2 veces por mes. Indispensable: Licencia de conducir vigente.,"$10,500 al mes",https://mx.indeed.com/rc/clk?jk=0899efc8894ecc26&fccid=8757b778a936cc74&vjs=3
Desarrollador Cobol,Bumeran,"Tlalpan, CDMX",Hace más de 30 días,2021-01-24,"En nuestro equipo, estamos buscando a un nuevo integrante, tenemos en mente personas que sientan verdadera pasión por la tecnología, con ganas de innovar,…",,https://mx.indeed.com/rc/clk?jk=2f086e4d9ba8d41b&fccid=f4ce47cf6f6f15f3&vjs=3
Técnico para Impresoras,ENLACE LABORAL,Ciudad de México,Hace más de 30 días,2021-01-24,“ Técnico de impresoras Multifuncionales De INYECCION”. Para una importante Empresa Trasnacional líder en impresión y consumibles.,"$7,000 - $8,000 al mes",https://mx.indeed.com/rc/clk?jk=db6dbebe5bd03c64&fccid=8757b778a936cc74&vjs=3
Desarrollador Java,Cloudco,"Cuauhtémoc, CDMX",Hace más de 30 días,2021-01-24,"Conocimientos en programación orientada a objetos Java o Python. Nos especializamos en la implementación, consultoría y desarrollo de la plataforma de…","$15,000 - $20,000 al mes",https://mx.indeed.com/rc/clk?jk=8545521f5b6b29e4&fccid=942c4ec626ccb63b&vjs=3
Auditor Contable Interno,AGZA Consultores,"Cuauhtémoc, CDMX",Hace más de 30 días,2021-01-24,"_*Importante grupo integrado por profesionales altamente experimentados en el ámbito fiscal, legal, laboral, administrativo y de programación, solicita: …","$25,000 - $30,000 al mes",https://mx.indeed.com/company/Aura-Smart-Luxury-Living/jobs/Auditor-contable-interno-854130f20606c1cf?fccid=258790730f791511&vjs=3
Becario de Sistemas,Consultoria IT,"Miguel Hidalgo, CDMX",Hace más de 30 días,2021-01-24,Conocimiento de bases de datos y de programación JAVA Y SQL.*. Empresa de Consultoría en TI solicita Becarios. Dominio del idioma inglés en un 80%.,"$6,000 - $7,000 al mes",https://mx.indeed.com/company/Hospitales-H/jobs/Becario-sistemas-7d84bc5a9e89aa5e?fccid=ce9331723189fed9&vjs=3
D2C MARKETING – MANAGER (LATAM),Fox Networks Group,"Colonia Lomas de Chapultepec, CDMX",Hace más de 30 días,2021-01-24,"Coordinación con equipos internos de producto: digital, redes, programación, PR, para generar acciones de adquisición y retención.",,https://mx.indeed.com/rc/clk?jk=e42234561c21f07d&fccid=1e6bb6ac32b82eea&vjs=3
RESPONSABLE DE AREA DE PICKING (CEDIS TOREO),Mobo,"Colonia Lomas de Chapultepec, CDMX",Hace más de 30 días,2021-01-24,IMPORTANTE EMPRESA DE DISTRIBUCION DE ACCESORIOS PARA CELULARES REQUIERE PARA SU CEDIS: RESPONSABLE DE AREA DE PICKING. Edad 24 a 38 años.,"$7,000 al mes",https://mx.indeed.com/rc/clk?jk=355192026558ae7a&fccid=76b2a7ad095a3f67&vjs=3
Gte Sup Mercados Otros Riesgos,Santander,"Cuajimalpa, CDMX",hace 17 días,2021-01-24,"Habilidades en programación - SAS, SQL o R. Analizar los portafolios de Riesgo de Crédito. Generar y actualizar la visión consolidada del perfil de riesgo de la…",,https://mx.indeed.com/rc/clk?jk=6a790b302109ea57&fccid=e57a47a3d1d90e39&vjs=3
Desarrollador .NET,AMK Technologies,"Tlalpan, CDMX",hace 1 día,2021-01-24,Esta vacante viene de la bolsa de empleo Talenteca.com. ¡SÚMATE A NUESTRO EQUIPO DE TRABAJO! Experiencia Laboral: Mínimo 2 a 3 años en puesto similar.,"$25,000 al mes",https://mx.indeed.com/rc/clk?jk=247e91ff2e2b8bd6&fccid=ca62e96f16888929&vjs=3
Supervisor Contable,AGZA Consultores,"Cuauhtémoc, CDMX",Hace más de 30 días,2021-01-24,"_*Importante firma contable integrada por profesionales altamente experimentados en el ámbito fiscal, legal, laboral, administrativo y de programación, solicita…","$17,000 - $20,000 al mes",https://mx.indeed.com/company/Aura-Smart-Luxury-Living/jobs/Supervisor-contable-79a7c41de865af0a?fccid=258790730f791511&vjs=3
Jefe de IT Bilingüe,Maguen Team SA. de CV.,"Miguel Hidalgo, CDMX",hace 9 días,2021-01-24,Análisis y Selección de soluciones tecnológicas. Elaboración de Planes de Trabajo. Generación de manuales y políticas para TI. Conocimiento en seguridad de TI.,"$30,000 al mes",https://mx.indeed.com/company/Maguen-Team-SA.-de-CV./jobs/Jefe-IT-biling%C3%BCe-8cd9fbb998df9a26?fccid=93eac4600cac7240&vjs=3
Front End Developer,N19,"Benito Juárez, CDMX",hace 3 días,2021-01-24,"Experiencia em desarrollo de software con múltiples lenguaje de programación. Nos encontramos en búsqueda de tu talento como Front End Engineer, para laborar…","$20,000 - $30,000 al mes",https://mx.indeed.com/company/n19/jobs/Front-end-developer-20bbd92637a9afb6?fccid=f208f717fa5b62cf&vjs=3
Ingenieros en sistemas - Programador,COSMETOBELLEZA,"Iztapalapa, CDMX",hace 17 días,2021-01-24,"Lenguajes de programación: Java, JavaScript, Delphi, . Importante empresa 100% mexicana solicita. Ingeniero en Sistemas (Desarrollo y Programación).","$12,000 - $18,000 al mes",https://mx.indeed.com/company/COSMETOBELLEZA/jobs/Ingenieros-sistemas-bf9ee1e53d91a3d9?fccid=61eb8c548cd76dcb&vjs=3
Ingeniero en Seguridad,Femsa,Ciudad de México,Hace más de 30 días,2021-01-24,"Te invitamos a formar parte de nuestro Equipo como : Buscamos persona organizada, proactiva, con excelente actitud de servicio.",,https://mx.indeed.com/rc/clk?jk=1bc3101bfe13d185&fccid=17dec61f51780d91&vjs=3
COORDINADORES CONTROL DE CALIDAD (Ropa Dama Multiestilos),Grupo Julio,Ciudad de México,Hace más de 30 días,2021-01-24,"Así como la programación en tiempos de entrega y manejo de personal. IMPORTANTE EMPRESA LIDER EN EL GIRO DE BOUTIQUES DE ROPA, CALZADO Y ACCESORIOS DE DAMA A…",,https://mx.indeed.com/rc/clk?jk=27413e2b0184c494&fccid=e2e4d9844dbb38b5&vjs=3
Becario American Express,American Express,Ciudad de México,Hace más de 30 días,2021-01-24,Interes por el area de programacion. Hay una diferencia entre tener un trabajo y hacer la diferencia. En American Express hemos marcado una diferencia en la…,,https://mx.indeed.com/rc/clk?jk=bd311f566c7b73f5&fccid=f057e04c37cca134&vjs=3
Diseñador Web jr,Bumeran,Ciudad de México,Hace más de 30 días,2021-01-24,"Manejo de lenguajes de programación como php, HTML5,Javascript, CSS3. Mantenimiento y soporte de sitios web ya desarrollados para clientes de la compañía.","$8,000 al mes",https://mx.indeed.com/rc/clk?jk=3bdf0694a3c15e22&fccid=f4ce47cf6f6f15f3&vjs=3
Developer Data Unix,Grupo Think HST,"Miguel Hidalgo, CDMX",hace 19 días,2021-01-24,"Manejo de Unix hacer programación, control M, Shell Scripting (Unix, SS Teradata). Para laborar 3 días en Toluca, Edo. de Méx. y 2 en Azcapotzalco, Cdmx.","$53,300 al mes",https://mx.indeed.com/company/Grupo-Think-HST/jobs/Developer-data-unix-7264211300865a76?fccid=4a4bea672214c84d&vjs=3
Tester Funcional,Capital Empresarial Horizonte,"Cuajimalpa, CDMX",hace 12 días,2021-01-24,"Conocimientos básicos de programación con J2E. Cualquier lenguaje de programación (Java, C##,...). Capital Empresarial Horizonte Empresa Mexicana especialista…","$34,000 al mes",https://mx.indeed.com/company/Capital-Empresarial-Horizonte/jobs/Tester-funcional-f0d853bba9e01a12?fccid=707df5bee5a2922f&vjs=3
Enfermero Quirúrgico,BIOSSMANN,"Cuauhtémoc, CDMX",hace 3 días,2021-01-24,Coordinación con médicos para programación de cirugía y material. En BIOSSMANN somos una empresa 100% mexicana con presencia a nivel nacional.,"$5,000 - $5,500 al mes",https://mx.indeed.com/company/Biossmann/jobs/Enfermero-quir%C3%BArgico-adf4bc62b3f6e969?fccid=5200aa79934fec46&vjs=3
Business Intelligence Analyst,Segundamano,Ciudad de México,Hace más de 30 días,2021-01-24,"Lenguajes de programación para minería y análisis de Big Data (SQL, Python, R). ¿Tomas decisiones basadas en datos? ¿Sabes que R es más que una simple letra?",,https://mx.indeed.com/rc/clk?jk=a39e9739711cd8c3&fccid=58000ab63795c5f4&vjs=3
Gerente de Medios Digitales,UIC Universidad Intercontinental,"Tlalpan, CDMX",Hace más de 30 días,2021-01-24,"Amplio conocimiento técnico en desarrollo de páginas web y programación (Wordpress, joomla y UX). Prestigiada universidad al sur de la ciudad solicita personal…","$25,000 al mes",https://mx.indeed.com/rc/clk?jk=f75966de2aed898f&fccid=832e75a6772b418b&vjs=3
Programador,COPPEL,"Miguel Hidalgo, CDMX",Hace más de 30 días,2021-01-24,"1 año en lenguajes de programación. Experto en programación Java (Struts, EJB, JSP, JSF). Programar la codificación de los sistemas, interpretación de las…",,https://mx.indeed.com/rc/clk?jk=a266c2a4970fa682&fccid=ee79d446554b2f96&vjs=3
Analista Mesa de Ayuda,Grupo Salinas,"Tlalpan, CDMX",Hace más de 30 días,2021-01-24,"Grupo Salinas es un conjunto de empresas dinámicas, de rápido crecimiento y a la vanguardia tecnológica, con enfoque en la creación de valor económico –al…",,https://mx.indeed.com/rc/clk?jk=2654d3aab02ae609&fccid=28689c4fbc9de9e7&vjs=3
